<!ELEMENT issue (title,section,submitter,date,priority?,(note,p*)?,discussion,(resolution|rationale|duplicate|note|blockquote)*)>
<!ATTLIST issue num CDATA #REQUIRED>
<!ATTLIST issue status CDATA #REQUIRED>
<!ELEMENT title ANY>
<!ELEMENT section (sref+)>
<!ELEMENT submitter (#PCDATA)>
<!ELEMENT date (#PCDATA)>
<!ELEMENT priority (#PCDATA)>
<!ELEMENT discussion ANY>
<!ELEMENT resolution ANY>
<!ELEMENT rationale ANY>
<!ELEMENT duplicate (iref)>
<!ELEMENT sref EMPTY>
<!ATTLIST sref ref CDATA #REQUIRED>
<!ELEMENT iref EMPTY>
<!ATTLIST iref ref CDATA #REQUIRED>
<!ELEMENT note ANY>

<!ENTITY % html-inline "tt|code|i|em|b|strong|u|a|sup|sub|br|var|span|dfn|del|ins">
<!ENTITY % html-table "table|thead|tbody|caption|tr|th|td">
<!ENTITY % html-list "ol|ul|li|dl|dt|dd">
<!ENTITY % html-block "p|pre|blockquote|h3|h4|h5|%html-table;|%html-list;">
<!ENTITY % mathml "mfenced|mfrac|msup||mrow|mi|mo|mn">
<!ENTITY % html "%html-inline; | %html-block; | %mathml;">

<!-- HTML elements used in issues -->
<!ELEMENT del ANY>
<!ELEMENT ins ANY>
<!ATTLIST ins style CDATA #IMPLIED>
<!ELEMENT pre ANY>
<!ELEMENT blockquote ANY>
<!ATTLIST blockquote class (note) #IMPLIED> <!-- issue 427 needs this -->
<!ELEMENT p ANY>
<!ATTLIST p style CDATA #IMPLIED>
<!ELEMENT h3 ANY>
<!ELEMENT h4 ANY>
<!ELEMENT h5 ANY>
<!ELEMENT ol (li+)>
<!ATTLIST ol style CDATA #IMPLIED>
<!ATTLIST ol start CDATA #IMPLIED>
<!ELEMENT ul (li+)>
<!ELEMENT li ANY>
<!ATTLIST li value CDATA #IMPLIED>
<!ELEMENT i ANY>
<!ELEMENT em ANY>
<!ELEMENT b ANY>
<!ELEMENT strong ANY>
<!ELEMENT u ANY>
<!ELEMENT tt ANY>
<!ELEMENT code ANY>
<!ELEMENT sup ANY>
<!ELEMENT sub ANY>
<!ELEMENT br ANY>
<!ELEMENT a ANY>
<!ATTLIST a href CDATA #IMPLIED>
<!ATTLIST a name CDATA #IMPLIED>
<!ELEMENT table (caption?,((thead?,tbody)|tr+))>
<!ATTLIST table style CDATA #IMPLIED>
<!ATTLIST table border CDATA #IMPLIED>
<!ATTLIST table cellpadding CDATA #IMPLIED>
<!ATTLIST table cellspacing CDATA #IMPLIED>
<!ATTLIST table rules CDATA #IMPLIED>
<!ELEMENT thead ANY>
<!ELEMENT tbody ANY>
<!ELEMENT tr ((th|td)+)>
<!ATTLIST tr align CDATA #IMPLIED>
<!ELEMENT th ANY>
<!ATTLIST th style CDATA #IMPLIED>
<!ATTLIST th colspan CDATA #IMPLIED>
<!ATTLIST th align CDATA #IMPLIED>
<!ELEMENT td ANY>
<!ATTLIST td style CDATA #IMPLIED>
<!ATTLIST td colspan CDATA #IMPLIED>
<!ATTLIST td rowspan CDATA #IMPLIED>
<!ATTLIST td align CDATA #IMPLIED>
<!ATTLIST td valign CDATA #IMPLIED>
<!ELEMENT caption ANY>
<!ELEMENT dl ((dd|dt)+)>
<!ELEMENT dt ANY>
<!ELEMENT dd ANY>
<!ELEMENT var ANY>
<!ELEMENT span ANY>
<!ATTLIST span style CDATA #IMPLIED>
<!ELEMENT dfn ANY>

<!-- MathML elements -->
<!ELEMENT math ((mrow|mi|mn|mo)*)>
<!ATTLIST math xmlns CDATA #REQUIRED>
<!ELEMENT mrow ((mfenced|mi|mo|mn|msup)*)>
<!ELEMENT mi (#PCDATA)>
<!ELEMENT mn (#PCDATA)>
<!ELEMENT mo (#PCDATA)>
<!ELEMENT mfenced (mfrac)>
<!ELEMENT msup ((mrow|mi)*)>
<!ELEMENT mfrac ((mrow|mi)*)>
<!ATTLIST mfrac linethickness CDATA #IMPLIED>

<!-- the common HTML entities for special characters -->
<!ENTITY Aacute     "&#xC1;">
<!ENTITY aacute     "&#xE1;">
<!ENTITY Acirc      "&#xC2;">
<!ENTITY acirc      "&#xE2;">
<!ENTITY Agrave     "&#xC0;">
<!ENTITY agrave     "&#xE0;">
<!ENTITY Atilde     "&#xC3;">
<!ENTITY atilde     "&#xE3;">
<!ENTITY Auml       "&#xC4;">
<!ENTITY auml       "&#xE4;">
<!ENTITY Ccedil     "&#xC7;">
<!ENTITY ccedil     "&#xE7;">
<!ENTITY deg        "&#xB0;">
<!ENTITY Delta      "&#x394;">
<!ENTITY delta      "&#x3B4;">
<!ENTITY divide     "&#xF7;">
<!ENTITY Eacute     "&#xC9;">
<!ENTITY eacute     "&#xE9;">
<!ENTITY Ecirc      "&#xCA;">
<!ENTITY ecirc      "&#xEA;">
<!ENTITY Egrave     "&#xC8;">
<!ENTITY egrave     "&#xE8;">
<!ENTITY empty      "&#x2205;">
<!ENTITY epsilon    "&#x3B5;">
<!ENTITY Euml       "&#xCB;">
<!ENTITY euml       "&#xEB;">
<!ENTITY exist      "&#x2203;">
<!ENTITY forall     "&#x2200;">
<!ENTITY frasl      "&#x2044;">
<!ENTITY ge         "&#x2265;">
<!ENTITY hArr       "&#x21D4;">
<!ENTITY harr       "&#x2194;">
<!ENTITY hellip     "&#x2026;">
<!ENTITY Iacute     "&#xCD;">
<!ENTITY iacute     "&#xED;">
<!ENTITY Icirc      "&#xCE;">
<!ENTITY icirc      "&#xEE;">
<!ENTITY Igrave     "&#xCC;">
<!ENTITY igrave     "&#xEC;">
<!ENTITY isin       "&#x2208;">
<!ENTITY Iuml       "&#xCF;">
<!ENTITY iuml       "&#xEF;">
<!ENTITY lArr       "&#x21D0;">
<!ENTITY larr       "&#x2190;">
<!ENTITY le         "&#x2264;">
<!ENTITY lfloor     "&#x230A;">
<!ENTITY mdash      "&#x2014;">
<!ENTITY micro      "&#xB5;">
<!ENTITY middot     "&#xB7;">
<!ENTITY Nacute     "&#x8f;">
<!ENTITY nacute     "&#x90;">
<!ENTITY nbsp       "&#xA0;">
<!ENTITY ndash      "&#x2013;">
<!ENTITY ni         "&#x220B;">
<!ENTITY notin      "&#x2209;">
<!ENTITY nsub       "&#x2284;">
<!ENTITY Ntilde     "&#xD1;">
<!ENTITY ntilde     "&#xF1;">
<!ENTITY Oacute     "&#xD3;">
<!ENTITY oacute     "&#xF3;">
<!ENTITY Ocirc      "&#xD4;">
<!ENTITY ocirc      "&#xF4;">
<!ENTITY Omicron    "&#x39F;">
<!ENTITY Otilde     "&#xD5;">
<!ENTITY otilde     "&#xF5;">
<!ENTITY Ouml       "&#xD6;">
<!ENTITY ouml       "&#xF6;">
<!ENTITY para       "&#xB6;">
<!ENTITY phi        "&#x3C6;">
<!ENTITY pi         "&#x3C0;">
<!ENTITY plusmn     "&#xB1;">
<!ENTITY rArr       "&#x21D2;">
<!ENTITY rarr       "&#x2192;">
<!ENTITY rfloor     "&#x230B;">
<!ENTITY rho        "&#x3C1;">
<!ENTITY Scaron     "&#x160;">
<!ENTITY scaron     "&#x161;">
<!ENTITY sect       "&#xA7;">
<!ENTITY sigma      "&#x3C3;">
<!ENTITY sub        "&#x2282;">
<!ENTITY sube       "&#x2286;">
<!ENTITY sum        "&#x2211;">
<!ENTITY sup        "&#x2283;">
<!ENTITY supe       "&#x2287;">
<!ENTITY szlig      "&#xDF;">
<!ENTITY Theta      "&#x398;">
<!ENTITY times      "&#xD7;">
<!ENTITY Uacute     "&#xDA;">
<!ENTITY uacute     "&#xFA;">
<!ENTITY Ucirc      "&#xDB;">
<!ENTITY ucirc      "&#xFB;">
<!ENTITY Ugrave     "&#xD9;">
<!ENTITY ugrave     "&#xF9;">
<!ENTITY Uuml       "&#xDC;">
<!ENTITY uuml       "&#xFC;">
<!ENTITY yacute     "&#xFD;">
<!ENTITY yuml       "&#xFF;">
