<?xml version='1.0' encoding='utf-8' standalone='no'?>
<!DOCTYPE issue SYSTEM "lwg-issue.dtd">

<issue num="2769" status="Open">
<title>Redundant <tt>const</tt> in the return type of <tt>any_cast(const any&amp;)</tt></title>
<section><sref ref="[any.nonmembers]"/></section>
<submitter>Casey Carter</submitter>
<date>2 Sep 2016</date>
<priority>0</priority>

<discussion>
<p>
The overload of <tt>any_cast</tt> that accepts a reference to constant <tt>any</tt>:
</p>
<blockquote>
<pre>
template&lt;class ValueType&gt;
  ValueType any_cast(const any&amp; operand);
</pre>
</blockquote>
<p>
is specified to return <tt>*any_cast&lt;add_const_t&lt;remove_reference_t&lt;ValueType&gt;&gt;&gt;(&amp;operand)</tt> in [any.nonmembers]/5. This calls the pointer-to-constant overload of <tt>any_cast</tt>:
</p>
<blockquote>
<pre>
template&lt;class ValueType&gt;
  const ValueType* any_cast(const any* operand) noexcept;
</pre>
</blockquote>
<p>
which is specified as:
</p>
<blockquote>
<i>Returns:</i> If <tt>operand != nullptr &amp;&amp; operand-&gt;type() == typeid(ValueType)</tt>, a pointer to the object contained by <tt>operand</tt>; otherwise, <tt>nullptr</tt>.
</blockquote>
<p>
Since <tt>typeid(T) == typeid(const T)</tt> for all types <tt>T</tt>, <tt>any_cast&lt;add_const_t&lt;T&gt;&gt;(&amp;operand)</tt> is equivalent to <tt>any_cast&lt;T&gt;(&amp;operand)</tt> for all types <tt>T</tt> when operand is a constant lvalue <tt>any</tt>. 
The <tt>add_const_t</tt> in the return specification of the first overload above is therefore redundant.
</p>

<note>2016-09-09 Issues Resolution Telecon</note>
<p>P0; move to Tentatively Ready</p>
<p>Casey will provide combined wording for this and <iref ref="2768"/>, since they modify the same paragraph.</p>

<p><strong>Previous resolution [SUPERSEDED]:</strong></p>
<blockquote class="note">
<p>This wording is relative to N4606.</p>

<ol>
<li><p>Modify <sref ref="[any.nonmembers]"/> as indicated:</p>
<blockquote>
<blockquote>
<pre>
template&lt;class ValueType&gt;
  ValueType any_cast(const any&amp; operand);
template&lt;class ValueType&gt;
  ValueType any_cast(any&amp; operand);
template&lt;class ValueType&gt;
  ValueType any_cast(any&amp;&amp; operand);
</pre>
</blockquote>
<p>
-4- <i>Requires:</i> <tt>is_reference_v&lt;ValueType&gt;</tt> is <tt>true</tt> or 
<tt>is_copy_constructible_v&lt;ValueType&gt;</tt> is <tt>true</tt>. Otherwise the program is ill-formed.
<p/>
-5- <i>Returns:</i> <del>For the first form, 
<tt>*any_cast&lt;add_const_t&lt;remove_reference_t&lt;ValueType&gt;&gt;&gt;(&amp;operand)</tt>. 
For the second and third forms,</del> <tt>*any_cast&lt;remove_reference_t&lt;ValueType&gt;&gt;(&amp;operand)</tt>.
<p/>
[&hellip;]
</p>
</blockquote>
</li>
</ol>
</blockquote>

<note>2016-09-09 Casey improves wording as determined by telecon</note>
<p>
The presented resolution is intended as the common wording for both LWG <iref ref="2768"/> and LWG <iref ref="2769"/>.
</p>

<p><strong>Previous resolution [SUPERSEDED]:</strong></p>
<blockquote class="note">
<p>This wording is relative to N4606.</p>

<ol>
<li><p>Modify <sref ref="[any.nonmembers]"/> as indicated:</p>
<blockquote>
<blockquote>
<pre>
template&lt;class ValueType&gt;
  ValueType any_cast(const any&amp; operand);
template&lt;class ValueType&gt;
  ValueType any_cast(any&amp; operand);
template&lt;class ValueType&gt;
  ValueType any_cast(any&amp;&amp; operand);
</pre>
</blockquote>
<p>
-4- <i>Requires:</i> <tt>is_reference_v&lt;ValueType&gt;</tt> is <tt>true</tt> or 
<tt>is_copy_constructible_v&lt;ValueType&gt;</tt> is <tt>true</tt>. Otherwise the program is ill-formed.
<p/>
-5- <i>Returns:</i> For the first <del>form, 
<tt>*any_cast&lt;add_const_t&lt;remove_reference_t&lt;ValueType&gt;&gt;&gt;(&amp;operand)</tt>. 
For the</del> <ins>and</ins> second <del>and third</del> form<del>s</del>, 
<tt>*any_cast&lt;remove_reference_t&lt;ValueType&gt;&gt;(&amp;operand)</tt>. <ins>For the third form, 
<tt>std::forward&lt;ValueType&gt;(*any_cast&lt;remove_reference_t&lt;ValueType&gt;&gt;(&amp;operand))</tt>.</ins>
<p/>
[&hellip;]
</p>
</blockquote>
</li>
</ol>
</blockquote>

<note>2016-10-05, Tomasz and Casey reopen and improve the wording</note>
<p>
The constraints placed on the non-pointer <tt>any_cast</tt> overloads are neither necessary nor sufficient to 
guarantee that the specified effects are well-formed. The current PR for LWG <iref ref="2769"/> also makes it 
possible to retrieve a dangling lvalue reference to a temporary any with e.g. <tt>any_cast&lt;int&amp;&gt;(any{42})</tt>, 
which should be forbidden.
</p>

</discussion>

<resolution>
<p>This wording is relative to N4606.</p>

<ol>
<li><p>Modify <sref ref="[any.nonmembers]"/> as indicated:</p>
<blockquote>
<blockquote>
<pre>
template&lt;class ValueType&gt;
  ValueType any_cast(const any&amp; operand);
template&lt;class ValueType&gt;
  ValueType any_cast(any&amp; operand);
template&lt;class ValueType&gt;
  ValueType any_cast(any&amp;&amp; operand);
</pre>
</blockquote>
<p>
-4- <i>Requires:</i> <del><tt>is_reference_v&lt;ValueType&gt;</tt> is <tt>true</tt> or 
<tt>is_copy_constructible_v&lt;ValueType&gt;</tt> is <tt>true</tt>.</del><ins>For the first 
overload, <tt>is_constructible_v&lt;ValueType, const remove_reference_t&lt;remove_cv_t&lt;ValueType&gt;&gt;&amp;&gt;</tt> 
is <tt>true</tt>. For the second overload, <tt>is_constructible_v&lt;ValueType, remove_reference_t&lt;remove_cv_t&lt;ValueType&gt;&gt;&amp;&gt;</tt> is <tt>true</tt>. For the third overload, <tt>is_constructible_v&lt;ValueType, 
remove_reference_t&lt;remove_cv_t&lt;ValueType&gt;&gt;&gt;</tt> is <tt>true</tt>.</ins> Otherwise the program is ill-formed.
<p/>
-5- <i>Returns:</i> For the first <del>form, 
<tt>*any_cast&lt;add_const_t&lt;remove_reference_t&lt;ValueType&gt;&gt;&gt;(&amp;operand)</tt>. 
For the</del> <ins>and</ins> second <del>and third</del> form<del>s</del>, 
<tt>*any_cast&lt;remove_reference_t&lt;ValueType&gt;&gt;(&amp;operand)</tt>. <ins>For the third form, 
<tt>std::forward&lt;ValueType&gt;(*any_cast&lt;remove_reference_t&lt;ValueType&gt;&gt;(&amp;operand))</tt>.</ins>
<p/>
[&hellip;]
</p>
</blockquote>
</li>
</ol>
</resolution>

</issue>

