<?xml version='1.0' encoding='utf-8' standalone='no'?>
<!DOCTYPE issue SYSTEM "lwg-issue.dtd">

<issue num="3395" status="New">
<title>Definition for three-way comparison needs to be updated (US 152)</title>
<section><sref ref="[defns.comparison]"/></section>
<submitter>Jeff Garland</submitter>
<date>10 Feb 2020</date>
<priority>99</priority>

<discussion>
<p><b>Addresses <a href="https://github.com/cplusplus/nbballot/issues/151">US 152</a></b></p>
<p>
This definition in <sref ref="[defns.comparison]"/> should be updated to accommodate the new 3-way comparison operator 
(<sref ref="[expr.spaceship]"/>) as well.
</p>
</discussion>

<resolution>
<p>This wording is relative to <a href="https://wg21.link/n4849">N4849</a>.</p>

<ol>
<li><p>Modify <sref ref="[defns.comparison]"/> as indicated:</p>

<blockquote>
<p>
<b>comparison function</b>
<p/>
operator function (<sref ref="[over.oper]"/>) for any of the equality (<sref ref="[expr.eq]"/>)<ins>,</ins> 
<del>or</del> relational (<sref ref="[expr.rel]"/>)<ins>, or three-way comparison 
(<sref ref="[expr.spaceship]"/>)</ins> operators
</p>
</blockquote>
</li>

</ol>
</resolution>

</issue>
