<?xml version='1.0' encoding='utf-8' standalone='no'?>
<!DOCTYPE issue SYSTEM "lwg-issue.dtd">

<issue num="2920" status="New">
<title>Add a deduction guide for creating a shared future from a future rvalue.</title>
<section><sref ref="[futures.shared_future]"/></section>
<submitter>United States</submitter>
<date>3 Feb 2017</date>
<priority>99</priority>

<discussion>
<b>Addresses US 164</b>

<p>Add a deduction guide for creating a shared future from a future rvalue.</p>

</discussion>

<resolution>
<p>This wording is relative to <a href="http://wg21.link/n4618">N4618</a>.</p>
<ol>
<li><p>Add to the synopsis of &lt;future&gt;:</p>
<blockquote><pre><ins>
template &lt;class R&gt;
shared_future(future&lt;R&gt;&amp;&amp;) -&gt; shared_future&lt;R&gt;;
</ins></pre></blockquote>
</li>
</ol>
</resolution>

</issue>
