<?xml version='1.0' encoding='utf-8' standalone='no'?>
<!DOCTYPE issue SYSTEM "lwg-issue.dtd">

<issue num="3002" status="C++20">
<title>[networking.ts] <tt>basic_socket_acceptor::is_open()</tt> isn't <tt>noexcept</tt></title>
<section><sref ref="[socket.acceptor.ops]"/></section>
<submitter>Jonathan Wakely</submitter>
<date>14 Jul 2017</date>
<priority>0</priority>

<discussion>
<p><b>Addresses: networking.ts</b></p>
<p>
<tt>basic_socket::is_open()</tt> is <tt>noexcept</tt>, but the corresponding function on
<tt>basic_socket_acceptor</tt> is not. This is a simple observer with a wide contract and cannot fail.</p>

<note>
2017-11-01 Moved to Tentatively Ready after 7 positive votes for P0 on c++std-lib.
</note>
<note>2018-3-17 Adopted in Jacksonville</note>
</discussion>

<resolution>
<p>This resolution is relative to <a href="https://wg21.link/n4656">N4656</a>.</p>

<ol>
<li><p>Edit <sref ref="[socket.acceptor]"/>, class template <tt>basic_socket_acceptor</tt> synopsis, as indicated:</p>

<blockquote>
<pre>
template&lt;class AcceptableProtocol&gt; 
class basic_socket_acceptor {
public:
  [&hellip;]
  bool is_open() const <ins>noexcept</ins>;
  [&hellip;]
};
</pre>
</blockquote>
</li>

<li><p>Edit <sref ref="[socket.acceptor.ops]"/> as indicated:</p>

<blockquote>
<pre>
bool is_open() const <ins>noexcept</ins>;
</pre>
<blockquote>
<p>
-10- <i>Returns:</i> A <tt>bool</tt> indicating whether this acceptor was opened by a previous call to <tt>open</tt> or <tt>assign</tt>.
</p>
</blockquote>
</blockquote>
</li>
</ol>
</resolution>
</issue>
