<?xml version='1.0' encoding='utf-8' standalone='no'?>
<!DOCTYPE issue SYSTEM "lwg-issue.dtd">

<issue num="3183" status="Voting">
<title>Normative permission to specialize Ranges variable templates</title>
<section><sref ref="[iterator.concept.sizedsentinel]"/></section>
<submitter>Casey Carter</submitter>
<date>14 Jan 2019</date>
<priority>0</priority>

<discussion>
<p>
<a href="https://wg21.link/p0896r4">P0896R4 "The One Ranges Proposal"</a> added
boolean variable templates <tt>std::disable_sized_sentinel</tt> and
<tt>std::ranges::disable_sized_range</tt> which users are intended to specialize
to <tt>false</tt> for program-defined <tt>Iterator</tt>-<tt>Sentinel</tt> pairs
/ <tt>Range</tt> types which meet the syntax but do not model
the semantics of the <tt>SizedSentinel</tt> / <tt>SizedRange</tt> concepts,
respectively. Specializing these traits allows the use of such types with the
library which would otherwise treat them as if they model <tt>SizedSentinel</tt>
/ <tt>SizedRange</tt>. The wording in P0896R4 failed, however, to provide
normative permission to specialize these variable templates as is required by
<sref ref="[namespace.std]"/> after the application of
<a href="https://wg21.link/p0551r3">P0551R3</a>.
</p><p>
Furthermore, <sref ref="[namespace.std]"/> notably does not require that
program-defined specializations of standard library variable templates meet the
requirements on the primary template (as is the case for class templates) or
indeed any requirements. P0896R4 also added the <tt>enable_view</tt> variable
template which is used to explicitly opt in or out of the <tt>View</tt> concept
<sref ref="[range.view]"/> when the default chosen by the heuristic is
incorrect. P0896R4 did include normative permission to specialize
<tt>enable_view</tt>, but the wording does not place sufficient requirements on
such user specializations so as to make them usable by the <tt>View</tt> concept
definition. Specializations must be required to be usable as constant
expressions of type <tt>bool</tt> to avoid hard errors in the concept.
</p>

<note>2019-02-03 Priority to 0 and Status to Tentatively Ready after five positive votes on the reflector.</note>
</discussion>

<resolution>
<p>This wording is relative to <a href="https://wg21.link/n4791">N4791</a>.</p>

<blockquote class="note">
<p>
[<i>Drafting Note:</i> This wording uses the recently-defined core language term
"usable in constant expressions" from <sref ref="[expr.const]"/> paragraph 3
which may be unfamiliar to reviewers.]
</p>
</blockquote>

<ol>
<li><p>Change <sref ref="[iterator.concept.sizedsentinel]"/> as follows:</p>
<blockquote>
<p>
[&hellip;]
</p><p>
(2.2) &mdash; If <tt>−N</tt> is representable by
<tt>iter_difference_t&lt;I&gt;</tt>, then <tt>i - s</tt> is well-defined and
equals <tt>−N</tt>.
</p><p>
<ins>-?- Pursuant to <sref ref="[namespace.std]"/>, users may specialize
<tt>disable_sized_sentinel</tt> for cv-unqualified non-array object types
<tt>S</tt> and <tt>I</tt> at least one of which is a program-defined type.
Such specializations shall be usable in constant expressions
(<sref ref="[expr.const]"/>) and have type <tt>const bool</tt>.</ins>
</p><p>
3 [<i>Note:</i> <tt>disable_sized_sentinel</tt> allows use of sentinels and
iterators with the library that satisfy but do not in fact model
<tt>SizedSentinel</tt>.&mdash;<i>end note</i>]
</p><p>
[&hellip;]
</p>
</blockquote>
</li>
<li><p>Add an index entry for <tt>disable_sized_sentinel</tt> that points to
<sref ref="[iterator.concepts.sizedsentinel]"/>.</p>
</li>
<li><p>Change <sref ref="[range.sized]"/> as follows:</p>
<blockquote>
<p>
[&hellip;]
</p><p>
3 [<i>Note:</i> The complexity requirement for the evaluation of
<tt>ranges::size</tt> is non-amortized, unlike the case for the complexity of
the evaluations of <tt>ranges::begin</tt> and <tt>ranges::end</tt> in the
<tt>Range</tt> concept.&mdash;<i>end note</i>]
</p><p>
<ins>-?- Pursuant to <sref ref="[namespace.std]"/>, users may specialize
<tt>disable_sized_range</tt> for cv-unqualified program-defined types.
Such specializations shall be usable in constant expressions
(<sref ref="[expr.const]"/>) and have type <tt>const bool</tt>.</ins>
</p><p>
4 [<i>Note:</i> <tt>disable_sized_range</tt> allows use of range types with the
library that satisfy but do not in fact model <tt>SizedRange</tt>.&mdash;<i>end
note</i>]
</p>
</blockquote>
</li>
<li><p>Add an index entry for <tt>disable_sized_range</tt> that points to
<sref ref="[range.sized]"/>.</p>
</li>
<li><p>Change <sref ref="[range.view]"/> as follows:</p>
<blockquote>
<p>
[&hellip;]
</p><p>
5 Pursuant to <sref ref="[namespace.std]"/>, users may specialize
<tt>enable_view</tt> to <tt>true</tt> for <ins>cv-unqualified
program-defined</ins> types which model <tt>View</tt>, and <tt>false</tt> for
types which do not. <ins>Such specializations shall be usable in constant
expressions (<sref ref="[expr.const]"/>) and have type <tt>const bool</tt>.</ins>
</p>
</blockquote>
</li>
</ol>
</resolution>
</issue>
