<?xml version='1.0' encoding='utf-8' standalone='no'?>
<!DOCTYPE issue SYSTEM "lwg-issue.dtd">

<issue num="3241" status="New">
<title><tt>chrono-spec</tt> grammar ambiguity in &sect;[time.format]</title>
<section><sref ref="[time.format]"/></section>
<submitter>Victor Zverovich</submitter>
<date>24 Jul 2019</date>
<priority>99</priority>

<discussion>
<p>
The <tt>chrono-spec</tt> grammar introduced by <a href="http://wg21.link/p1361r2">P1361R2</a> "Integration 
of chrono with text formatting" in section [time.format] is ambiguous because <tt>'%'</tt> can be 
interpreted as either <tt>literal-char</tt> or <tt>conversion-spec</tt>:
</p>
<blockquote><pre>
chrono-spec     ::= literal-char | conversion-spec
literal-char    ::= &lt;a character other than '{' or '}'&gt;
conversion-spec ::= '%' [modifier] type
</pre></blockquote>
</discussion>
<resolution>
<p>This wording is relative to the Post Cologne working draft.</p>

<ol>
<li><p>Modify the <tt>literal-char</tt> grammar in [time.format] as indicated:</p>

<blockquote>
<pre>
literal-char ::= &lt;a character other than '{'<del> or</del><ins>,</ins> '}'<ins>, or '%'</ins>&gt;
</pre>
</blockquote>
</li>
</ol>
</resolution>
</issue>
